{
  "schema": "echelon.current-channel/v1",
  "id": "echelon-current",
  "profile": {
    "id": "echelon-current",
    "version": "1.32.0",
    "sha256": "001fb6807901ce496b6e6faeee501c26d7c606e6f313ffed908c083e6f8a8d90"
  },
  "catalogSnapshot": {
    "path": "snapshots/echelon-current.catalog.json",
    "sha256": "a6c21d3dbb6352fdcc0672719789fdc729460c2cb1dbcd3e2e0ef6f8c254cfde"
  },
  "platforms": [
    {
      "platform": "linux-x64",
      "path": "channels/echelon-current/linux-x64.json",
      "sha256": "bf52d105279f5239697239cd7d57485f632f022f7bb89e2ca89cc852314527d1"
    },
    {
      "platform": "linux-arm64",
      "path": "channels/echelon-current/linux-arm64.json",
      "sha256": "f9dbdbc65eda20aa9f0287b7180187d69ebe460d3abe12bdb2bd0b56b764a43b"
    },
    {
      "platform": "osx-x64",
      "path": "channels/echelon-current/osx-x64.json",
      "sha256": "73be7eceed2bb8a250f6eeaea2f84419b1fe67f17bdc5ed92251f4e53f2a42ad"
    },
    {
      "platform": "osx-arm64",
      "path": "channels/echelon-current/osx-arm64.json",
      "sha256": "ee01c205ab1120dfd5bf3a090e6561d3dff081bb820e83afdcc34cf4c4423301"
    },
    {
      "platform": "win-x64",
      "path": "channels/echelon-current/win-x64.json",
      "sha256": "d8dd56adaa9c83e8a8272efff0ec1c16f3a0af18e5d3ecd37d53a7d2a4c72bbc"
    }
  ]
}
